{
  "schema_version": "1.0",
  "source_identity": {
    "canonical_url": "https://www.xiaoyuzhoufm.com/episode/6ab61d4b195d838e2ae9fc1e",
    "adapter_version": "1.0.2"
  },
  "episode": {
    "id": "6ab61d4b195d838e2ae9fc1e",
    "title": "EP59：我们都活在指数里",
    "podcast_name": "纵横四海｜番外",
    "published_at": "2026-09-27T16:00:00.000Z",
    "duration_seconds": 10853,
    "show_notes": "<p><span>本期内容来自 9 月 6 日在成都举行的一场《纵横四海》线下专场分享，感谢华夏基金的邀请。这次我们聊的主题是：</span><strong><span>我们都活在指数里。</span></strong></p><p><span>我们很习惯给投资做配置，却很少认真想过：自己的人生，其实也一直在被“配置”。</span></p><p><span>ETF 的逻辑很简单：不要把希望单押在一个标的上，而是把一篮子重要的东西组合起来，分散风险、长期配置。</span></p><p><span>人生也是一样。</span></p><p><span>如果你不主动配置自己的健康、注意力、能力、关系和风险，平台、工作、算法和社会期待，就会替你配置。</span></p><p><span>所以这期，我想和大家一起搭四只「人生 ETF」：</span></p><p><strong><span>深度健康 ETF</span></strong><span>：饮食、睡眠、运动、心理健康、压力管理，以及更了解自己的身体。</span><br><strong><span>AI 时代护城河 ETF</span></strong><span>：商业知识、深度阅读与思辨、务实主义。</span><br><strong><span>注意力分配 ETF</span></strong><span>：真正稀缺的不是时间，而是你把注意力放在哪里。</span><br><strong><span>风险管理 ETF</span></strong><span>：不要让人生只有 Plan A，给意外、变化和最坏结果留出空间。</span></p><p><span>如果要把这一期浓缩成两个词，就是：</span></p><p><strong><span>一揽子。主动构建。</span></strong></p><p><span>不要把人生单押在一份工作、一种能力、一段关系，或者一个即时满足上。</span></p><p><span>先主动选择，再让它长期运行。</span></p><p><span>---------------------------</span></p><p><span>欢迎在以下平台关注我们：</span></p><p><span>携隐Melody：</span><a href=\"https://www.xiaohongshu.com/user/profile/64a39690000000000b014ed7\" data-url=\"https://www.xiaohongshu.com/user/profile/64a39690000000000b014ed7\"><u><span>小红书🍠</span></u></a><span> | </span><a href=\"https://m.weibo.cn/u/1751530365\" data-url=\"https://m.weibo.cn/u/1751530365\"><u><span>微博🧣</span></u></a><span> | </span><a href=\"https://okjk.co/huFf4k\" data-url=\"https://okjk.co/huFf4k\"><u><span>即刻🟡</span></u></a><span> | </span><a href=\"https://mp.weixin.qq.com/s/z7Pc92u9OJD_Qohattp8Mg\" data-url=\"https://mp.weixin.qq.com/s/z7Pc92u9OJD_Qohattp8Mg\"><u><span>公众号💚</span></u></a></p><p><span>纵横四海：</span><a href=\"https://www.xiaohongshu.com/user/profile/57d789b882ec391d77293467\" data-url=\"https://www.xiaohongshu.com/user/profile/57d789b882ec391d77293467\"><u><span>小红书🍠</span></u></a><span> | </span><a href=\"https://m.weibo.cn/u/7859268400\" data-url=\"https://m.weibo.cn/u/7859268400\"><u><span>微博🧣</span></u></a><span> | </span><a href=\"https://okjk.co/QXLPi1\" data-url=\"https://okjk.co/QXLPi1\"><u><span>即刻🟡</span></u></a></p><p><span>---------------------------</span></p><p><span>📝 </span><strong><span>时间轴</span></strong></p><p><strong><span><a class=\"timestamp\" data-timestamp=\"5\">00:05</a></span></strong><span> 开场：为什么要主动配置自己的人生</span><br><strong><span><a class=\"timestamp\" data-timestamp=\"91\">01:31</a></span></strong><span> 为什么说「我们都活在指数里」</span><br><strong><span><a class=\"timestamp\" data-timestamp=\"135\">02:15</a></span></strong><span> 用麦当劳套餐理解“一揽子配置”</span><br><strong><span><a class=\"timestamp\" data-timestamp=\"435\">07:15</a></span></strong><span> 如果你不主动选择，别人就会替你配置人生</span><br><strong><span><a class=\"timestamp\" data-timestamp=\"984\">16:24</a></span></strong><span> 信息从哪里来：阅读、算法与注意力争夺</span><br><strong><span><a class=\"timestamp\" data-timestamp=\"1970\">32:50</a></span></strong><span> 人生的四根支柱正式展开</span><br><strong><span><a class=\"timestamp\" data-timestamp=\"2011\">33:31</a></span></strong><span> 深度健康：饮食、睡眠、运动和心理健康</span><br><strong><span><a class=\"timestamp\" data-timestamp=\"3796\">01:03:16</a></span></strong><span> 压力管理：很多“性格问题”其实只是压力过载</span><br><strong><span><a class=\"timestamp\" data-timestamp=\"4026\">01:07:06</a></span></strong><span> 生物黑客：真正了解自己的身体</span><br><strong><span><a class=\"timestamp\" data-timestamp=\"4271\">01:11:11</a></span></strong><span> AI 时代，什么才是真正的护城河</span><br><strong><span><a class=\"timestamp\" data-timestamp=\"4816\">01:20:16</a></span></strong><span> 商业知识、深度阅读、思辨与务实主义</span><br><strong><span><a class=\"timestamp\" data-timestamp=\"5653\">01:34:13</a></span></strong><span> 比时间更稀缺的，是你的注意力</span><br><strong><span><a class=\"timestamp\" data-timestamp=\"6019\">01:40:19</a></span></strong><span> 风险管理：为什么人生一定要有 Plan B</span><br><strong><span><a class=\"timestamp\" data-timestamp=\"6625\">01:50:25</a></span></strong><span> 总结：一揽子 + 主动构建</span><br><strong><span><a class=\"timestamp\" data-timestamp=\"6678\">01:51:18</a></span></strong><span> Q&amp;A：如果只能给 18 岁的自己一句建议</span><br><strong><span><a class=\"timestamp\" data-timestamp=\"7320\">02:02:00</a></span></strong><span> Q&amp;A：SOP 会不会让人生失去浪漫</span><br><strong><span><a class=\"timestamp\" data-timestamp=\"8778\">02:26:18</a></span></strong><span> Q&amp;A：思辨能力到底怎么练</span><br><strong><span><a class=\"timestamp\" data-timestamp=\"9458\">02:37:38</a></span></strong><span> Q&amp;A：朋友渐行渐远、女性愤怒与如何保持主体性</span></p><p></p><p><strong><span>风险提示</span></strong><span>：本节目所有投资相关内容皆以交流分享为目的，仅供参考，不构成任何市场预测、判断，或投资、咨询建议。本节目不作为基金或个股推荐，不作为任何法律文件，内容中的所有信息或所表达意见不构成投资、法律、会计或税务的最终操作建议，华夏基金不就资料中的内容对最终操作建议做出任何担保。在任何情况下，本公司不对任何人因使用本资料中的任何内容所引致的任何损失负任何责任。我国基金运作时间较短，不能反映股市发展的所有阶段。投资者在投资基金之前，请仔细阅读基金的《基金合同》《招募说明书》和《产品资料概要》等基金法律文件，充分认识基金的风险收益特征和产品特性，并根据自身的投资目的、投资期限、投资经验、资产状况等因素充分考虑自身的风险承受能力，在了解产品情况及销售适当性意见的基础上，理性判断并谨慎做出投资决策，独立承担投资风险。本节目仅限于基金管理人与合作平台开展宣传推广之目的，禁止第三方机构单独摘引、截取或以其他不恰当方式转载。基金有风险，投资须谨慎。</span></p><img src=\"https://image.xyzcdn.net/Fi70d4IV8GpADVNAUiJefx7ejCr0.jpeg\"><p></p>",
    "cover_url": "https://image.xyzcdn.net/FgNWADmPr3--xlycNDq0Ob4uxRNZ.png",
    "audio_candidates": [
      "https://media.xyzcdn.net/656ee903c1a8b2b479715ca2/lpcCq-_jiHeGEq55mF9Fopb9HtHg.m4a"
    ]
  },
  "source_refs": [
    {
      "kind": "input_url",
      "locator": "https://www.xiaoyuzhoufm.com/episode/6ab61d4b195d838e2ae9fc1e",
      "retrieved_at": "2026-10-01T22:21:41.923Z"
    },
    {
      "kind": "html_meta",
      "locator": "https://www.xiaoyuzhoufm.com/episode/6ab61d4b195d838e2ae9fc1e",
      "retrieved_at": "2026-10-01T22:21:41.923Z",
      "note": "HTML metadata and structured-data extraction"
    },
    {
      "kind": "embedded_json",
      "locator": "https://www.xiaoyuzhoufm.com/episode/6ab61d4b195d838e2ae9fc1e",
      "retrieved_at": "2026-10-01T22:21:41.923Z"
    }
  ]
}
